[
  {
    "id": "feed-8591ceddec",
    "source_feed_id": "feed-8591ceddec",
    "title": "order_facts::business-finance",
    "source_family": "order_facts",
    "registry_group": "business_finance_roots",
    "root_path": "/Users/liming/Documents/codex-ai-gua-jia-01/input/business-finance",
    "origin_device": "current-mac",
    "owner_account_id": "",
    "status": "active",
    "recognized_file_count": 3,
    "unclassified_file_count": 0,
    "last_scanned_at": "2026-03-14T21:48:39+08:00",
    "source_ref": "/Users/liming/Documents/codex-ai-gua-jia-01/input/business-finance",
    "confidence": 0.88,
    "updated_at": "2026-03-14T21:48:39+08:00"
  },
  {
    "id": "feed-0982ddc1af",
    "source_feed_id": "feed-0982ddc1af",
    "title": "governance_artifact::IntelligencePlatform",
    "source_family": "governance_artifact",
    "registry_group": "governance_roots",
    "root_path": "/Users/liming/Library/IntelligencePlatform",
    "origin_device": "current-mac",
    "owner_account_id": "",
    "status": "active",
    "recognized_file_count": 3042,
    "unclassified_file_count": 0,
    "last_scanned_at": "2026-03-14T21:48:39+08:00",
    "source_ref": "/Users/liming/Library/IntelligencePlatform",
    "confidence": 0.88,
    "updated_at": "2026-03-14T21:48:39+08:00"
  }
]
